{
  "schemaVersion": "source_extraction_v1",
  "sourceType": "TEXT",
  "source": {
    "textEvidenceId": "text-empty-009",
    "sourceSha256": "90925068fd774d6f231bdd94ce69da7113b065584a08510af61db5640c704423"
  },
  "extractionIdentity": {
    "schemaVersion": "source_extraction_v1",
    "implementationVersion": "source_extractor_v1.0.0",
    "parserProfile": "TEXT_DIRECT"
  },
  "sourceNormalizationApplied": "PRODUCT_NFC_LINEENDINGS_TRIM",
  "offsetUnit": "UNICODE_CODE_POINT",
  "coverageStatus": "FULL",
  "pages": [],
  "documentCanonicalText": "",
  "segments": [],
  "diagnostics": [
    {
      "code": "EMPTY_SOURCE_TEXT",
      "severity": "INFO",
      "scope": "SOURCE",
      "pageIndex": null,
      "affectsCoverage": false,
      "detail": "unreachable under current productive validation"
    }
  ],
  "artifactContentFingerprint": "0064fa220ee7eaf3dfc124e6e9dab0f58ed11289e596a6c1cf3f545b8f15eeac"
}
