{
  "schemaVersion": "source_extraction_v1",
  "sourceType": "PDF_DOCUMENT",
  "source": {
    "documentEvidenceId": "doc-full-001",
    "sourceSha256": "c1531d6fb9d7025adf91eb94339858687f4388b8c0164ecfeff813d7e2ab416e",
    "storageKey": "documents/doc-full-001.pdf"
  },
  "extractionIdentity": {
    "schemaVersion": "source_extraction_v1",
    "implementationVersion": "source_extractor_v1.0.0",
    "parserProfile": "PDFPLUMBER",
    "dependencyFingerprint": "edec374aa0435140628ef8f243209c1773b84cb13a1ec1868d394ca8e0409834"
  },
  "sourceNormalizationApplied": "NONE",
  "offsetUnit": "UNICODE_CODE_POINT",
  "coverageStatus": "FULL",
  "pages": [
    {
      "pageIndex": 0,
      "pageNumber": 1,
      "canonicalText": "Programa de la materia.\n\nContenidos: bases de datos relacionales.",
      "pageOffsetStart": 0,
      "pageOffsetEnd": 65,
      "pageObservationStatus": "EXTRACTED"
    },
    {
      "pageIndex": 1,
      "pageNumber": 2,
      "canonicalText": "Bibliografia obligatoria.\n\nEvaluacion final integradora.",
      "pageOffsetStart": 67,
      "pageOffsetEnd": 123,
      "pageObservationStatus": "EXTRACTED"
    }
  ],
  "documentCanonicalText": "Programa de la materia.\n\nContenidos: bases de datos relacionales.\n\nBibliografia obligatoria.\n\nEvaluacion final integradora.",
  "segments": [
    {
      "segmentId": "p0:0-23",
      "pageIndex": 0,
      "charStart": 0,
      "charEnd": 23,
      "exactExcerpt": "Programa de la materia."
    },
    {
      "segmentId": "p0:25-65",
      "pageIndex": 0,
      "charStart": 25,
      "charEnd": 65,
      "exactExcerpt": "Contenidos: bases de datos relacionales."
    },
    {
      "segmentId": "p1:0-25",
      "pageIndex": 1,
      "charStart": 0,
      "charEnd": 25,
      "exactExcerpt": "Bibliografia obligatoria."
    },
    {
      "segmentId": "p1:27-56",
      "pageIndex": 1,
      "charStart": 27,
      "charEnd": 56,
      "exactExcerpt": "Evaluacion final integradora."
    }
  ],
  "diagnostics": [],
  "artifactContentFingerprint": "0fb1812b4df4e7565a92edb3fae8f685c03431c23f0ed609ea3dd0f31f5549f3"
}
