{
  "schemaVersion": "source_extraction_v1",
  "sourceType": "PDF_DOCUMENT",
  "source": {
    "documentEvidenceId": "doc-astral-006",
    "sourceSha256": "00656424fa3ccfe0d5bcd63ba103c2a9b191c7edea99e132e26a3ae4243d2339",
    "storageKey": "documents/doc-astral-006.pdf"
  },
  "extractionIdentity": {
    "schemaVersion": "source_extraction_v1",
    "implementationVersion": "source_extractor_v1.0.0",
    "parserProfile": "PDFPLUMBER",
    "dependencyFingerprint": "edec374aa0435140628ef8f243209c1773b84cb13a1ec1868d394ca8e0409834"
  },
  "sourceNormalizationApplied": "NONE",
  "offsetUnit": "UNICODE_CODE_POINT",
  "coverageStatus": "FULL",
  "pages": [
    {
      "pageIndex": 0,
      "pageNumber": 1,
      "canonicalText": "Practica de laboratorio 🧪 con espacio duro.\n\nSegunda linea con emoji 🔬 y NBSP final.",
      "pageOffsetStart": 0,
      "pageOffsetEnd": 84,
      "pageObservationStatus": "EXTRACTED"
    }
  ],
  "documentCanonicalText": "Practica de laboratorio 🧪 con espacio duro.\n\nSegunda linea con emoji 🔬 y NBSP final.",
  "segments": [
    {
      "segmentId": "p0:0-43",
      "pageIndex": 0,
      "charStart": 0,
      "charEnd": 43,
      "exactExcerpt": "Practica de laboratorio 🧪 con espacio duro."
    },
    {
      "segmentId": "p0:45-84",
      "pageIndex": 0,
      "charStart": 45,
      "charEnd": 84,
      "exactExcerpt": "Segunda linea con emoji 🔬 y NBSP final."
    }
  ],
  "diagnostics": [],
  "artifactContentFingerprint": "0ec9f0a1160b7f8b9f8468291afb8dfce774e9e753284d47a940c111a7bad1ff"
}
